{
  "$schema": "https://json-schema.org/draft/2020-12/schema",
  "$id": "https://mythicalvoid.com/company/schemas/protected-nonce-concurrency-and-failover.schema.json",
  "title": "Mythical protected nonce concurrency and failover rehearsal",
  "type": "object",
  "required": ["schemaVersion", "asOf", "status", "purpose", "decisionRefs", "riskRefs", "workflowRefs", "authority", "sourceEvidence", "noncePolicy", "scenarioPlan", "refusalPlan", "rehearsalStore", "productionNoncePolicy", "activationGates", "scenarioCount", "concurrentAllocatorProcessCount", "retryClaimantProcessCount", "refusalScenarioCount", "expectedRefusalCount", "configuredProductionNonceControlCount", "configuredProductionIdentityCount", "satisfiedActivationGateCount", "nonceConcurrencyContractReadyForReview", "productionNonceSafetyReady", "productionFailoverNonceSafetyReady", "eligibleCycleReady", "externalActionAuthorized", "nextDecision"],
  "properties": {
    "schemaVersion": { "const": 1 },
    "asOf": { "type": "string", "format": "date" },
    "status": { "const": "offline_nonce_concurrency_crash_and_failover_rehearsal_ready_production_nonce_service_gated" },
    "purpose": { "type": "string", "minLength": 1200 },
    "decisionRefs": { "type": "array", "uniqueItems": true },
    "riskRefs": { "type": "array", "uniqueItems": true },
    "workflowRefs": { "type": "array", "uniqueItems": true },
    "authority": { "type": "object", "additionalProperties": { "const": false } },
    "sourceEvidence": { "type": "object" },
    "noncePolicy": { "type": "object" },
    "scenarioPlan": { "type": "object" },
    "refusalPlan": { "type": "object" },
    "rehearsalStore": { "type": "object" },
    "productionNoncePolicy": { "type": "object" },
    "activationGates": { "type": "array", "minItems": 18, "maxItems": 18 },
    "scenarioCount": { "const": 12 },
    "concurrentAllocatorProcessCount": { "const": 16 },
    "retryClaimantProcessCount": { "const": 8 },
    "refusalScenarioCount": { "const": 22 },
    "expectedRefusalCount": { "const": 22 },
    "configuredProductionNonceControlCount": { "const": 0 },
    "configuredProductionIdentityCount": { "const": 0 },
    "satisfiedActivationGateCount": { "const": 0 },
    "nonceConcurrencyContractReadyForReview": { "const": true },
    "productionNonceSafetyReady": { "const": false },
    "productionFailoverNonceSafetyReady": { "const": false },
    "eligibleCycleReady": { "const": false },
    "externalActionAuthorized": { "const": false },
    "nextDecision": { "type": "string", "minLength": 1200 }
  },
  "additionalProperties": false
}
