{
  "schemaVersion": 1,
  "asOf": "2026-08-11",
  "status": "offline_nonce_concurrency_crash_and_failover_rehearsal_ready_production_nonce_service_gated",
  "purpose": "Define and adversarially rehearse the concurrent nonce-allocation, crash, retry, rollback, failover, key-rotation, and exhaustion boundary required before Mythical may rely on A-053 cryptographic-misuse evidence in a multi-worker runtime. The control consumes current A-053 output and contract digests, launches sixteen real simultaneous allocator processes against one exclusive-create nonce namespace, requires sixteen unique winners, completes authenticated AES-256-GCM round trips only after durable allocation, and launches eight real retry claimants for one request with exactly one commit winner. It burns rather than reuses nonces reserved before crash, cancellation, or global disable; advances the counter after failover; rejects a rollback snapshot behind an independent high-watermark anchor; quarantines corrupt ledger state; separates key-version namespaces; detects a cross-region duplicate before encryption; refuses counter exhaustion and stale fencing; and rechecks global disable immediately before encryption. Every decision is payload-free and digest-bound. Temporary keys, allocations, ledgers, anchors, request claims, ciphertexts, mutations, and quarantine evidence are removed. The rehearsal configures no production provider, account, identity, key, nonce service, consensus store, region, objective, alert route, network, restore, admission, scheduler, dispatch, spend, or external action and grants no eligible-cycle credit.",
  "decisionRefs": ["D-014", "D-017"],
  "riskRefs": ["R-011", "R-013"],
  "workflowRefs": ["A-012", "A-023", "A-030", "A-031", "A-035", "A-041", "A-042", "A-046", "A-047", "A-048", "A-049", "A-050", "A-051", "A-052", "A-053", "A-054"],
  "authority": {
    "productionNonceAllocationAuthorized": false,
    "productionCryptographicPolicyAuthorized": false,
    "productionKeyManagementAuthorized": false,
    "productionConsensusAuthorized": false,
    "productionRecoveryAuthorized": false,
    "productionRecordWriteAuthorized": false,
    "schedulerActivationAuthorized": false,
    "triggerActivationAuthorized": false,
    "packetAdmissionAuthorized": false,
    "packetExecutionAuthorized": false,
    "credentialUseAuthorized": false,
    "networkAccessAuthorized": false,
    "repositoryWriteAuthorized": false,
    "automatedDispatchAuthorized": false,
    "spendAuthorized": false,
    "externalActionAuthorized": false,
    "conversationIsAuthorization": false
  },
  "sourceEvidence": {
    "cryptographicMisuseWorkflowId": "A-053",
    "cryptographicMisuseContractPath": "docs/company/automation/protected-cryptographic-misuse-and-recovery-poisoning.json",
    "currentCryptographicMisuseEvidenceDigestRequired": true,
    "currentCryptographicMisuseContractDigestRequired": true,
    "cryptographicMisuseExitCode": 2,
    "cryptographicMisuseRehearsalValidRequired": true,
    "rawEvidencePayloadPermitted": false,
    "scheduledCompanyWorkflowInvocationPermitted": false
  },
  "noncePolicy": {
    "allocationSchemaVersion": 1,
    "digestAlgorithm": "sha256",
    "encryptionAlgorithm": "aes-256-gcm",
    "keyByteLength": 32,
    "nonceByteLength": 12,
    "authenticationTagByteLength": 16,
    "currentKeyVersion": "KV-002",
    "rotatedKeyVersion": "KV-003",
    "allocatorProcessCount": 16,
    "retryClaimantProcessCount": 8,
    "maximumCounter": 20,
    "currentFencingToken": 6,
    "maximumRaceMilliseconds": 3000,
    "allocationMustPrecedeEncryption": true,
    "exclusiveAllocationRequired": true,
    "crashReservedNonceMayBeReused": false,
    "cancelledNonceMayBeReused": false,
    "disabledNonceMayBeReused": false,
    "rollbackSnapshotMayLowerHighWatermark": false,
    "corruptLedgerMayAllocate": false,
    "staleFenceMayAllocate": false,
    "uncoordinatedRegionalAllocationPermitted": false,
    "counterWrapPermitted": false,
    "globalDisableCheckedImmediatelyBeforeEncryption": true,
    "rawPayloadIncluded": false,
    "productionCredentialMaterialIncluded": false,
    "externalActionAuthorized": false,
    "sensitivePayloadIncluded": false,
    "allocationFields": ["schemaVersion", "allocationId", "requestId", "keyVersion", "counter", "nonceHex", "sourceWorkflowId", "sourceEvidenceDigestSha256", "sourceContractDigestSha256", "fencingToken", "status", "externalActionAuthorized", "sensitivePayloadIncluded"]
  },
  "scenarioPlan": {
    "scenarioCount": 12,
    "scenarios": [
      { "sequence": 1, "id": "NC-001", "fault": "sixteen_simultaneous_nonce_allocators", "expectedOutcome": "sixteen_unique_allocations_and_round_trips" },
      { "sequence": 2, "id": "NC-002", "fault": "eight_simultaneous_retries_for_one_request", "expectedOutcome": "exactly_one_request_commit_winner" },
      { "sequence": 3, "id": "NC-003", "fault": "crash_after_nonce_reservation_before_encryption", "expectedOutcome": "reserved_nonce_burned" },
      { "sequence": 4, "id": "NC-004", "fault": "failover_after_crashed_reservation", "expectedOutcome": "counter_advances_without_reuse" },
      { "sequence": 5, "id": "NC-005", "fault": "restore_ledger_snapshot_behind_anchor", "expectedOutcome": "rollback_snapshot_refused" },
      { "sequence": 6, "id": "NC-006", "fault": "corrupt_ledger_state", "expectedOutcome": "corrupt_ledger_quarantined" },
      { "sequence": 7, "id": "NC-007", "fault": "rotate_key_version_and_restart_counter", "expectedOutcome": "key_version_namespace_separated" },
      { "sequence": 8, "id": "NC-008", "fault": "uncoordinated_region_reissues_existing_nonce", "expectedOutcome": "cross_region_duplicate_refused_before_encryption" },
      { "sequence": 9, "id": "NC-009", "fault": "allocate_beyond_counter_maximum", "expectedOutcome": "counter_exhaustion_refused" },
      { "sequence": 10, "id": "NC-010", "fault": "allocate_with_stale_fencing_token", "expectedOutcome": "stale_fence_refused" },
      { "sequence": 11, "id": "NC-011", "fault": "cancel_after_allocation_before_encryption", "expectedOutcome": "cancelled_nonce_burned" },
      { "sequence": 12, "id": "NC-012", "fault": "global_disable_after_allocation_before_encryption", "expectedOutcome": "disabled_nonce_burned_and_effect_refused" }
    ],
    "expectedPassedScenarioCount": 12,
    "expectedConcurrentAllocatorProcessCount": 16,
    "expectedConcurrentUniqueAllocationCount": 16,
    "expectedRetryClaimantProcessCount": 8,
    "expectedRetryWinnerCount": 1,
    "expectedRetryLoserCount": 7,
    "expectedSuccessfulEncryptionCount": 18,
    "expectedAuthenticatedRoundTripCount": 18,
    "expectedBurnedNonceCount": 3,
    "expectedRollbackRefusalCount": 1,
    "expectedCorruptLedgerQuarantineCount": 1,
    "expectedCrossRegionDuplicateRefusalCount": 1,
    "expectedCounterExhaustionRefusalCount": 1,
    "expectedStaleFenceRefusalCount": 1,
    "expectedGlobalDisableEffectBlockCount": 1,
    "expectedReusedNonceEncryptionCount": 0
  },
  "refusalPlan": {
    "scenarioCount": 22,
    "expectedRefusalCount": 22,
    "scenarios": [
      { "id": "NF-001", "mutation": "substitute_A-053_evidence", "expectedReasonCode": "source_evidence_mismatch" },
      { "id": "NF-002", "mutation": "substitute_A-053_contract_digest", "expectedReasonCode": "source_contract_mismatch" },
      { "id": "NF-003", "mutation": "remove_required_field", "expectedReasonCode": "allocation_fields_invalid" },
      { "id": "NF-004", "mutation": "add_payload_field", "expectedReasonCode": "allocation_fields_invalid" },
      { "id": "NF-005", "mutation": "invalid_nonce_length", "expectedReasonCode": "nonce_invalid" },
      { "id": "NF-006", "mutation": "nonce_counter_mismatch", "expectedReasonCode": "nonce_invalid" },
      { "id": "NF-007", "mutation": "unknown_key_version", "expectedReasonCode": "key_version_invalid" },
      { "id": "NF-008", "mutation": "counter_zero", "expectedReasonCode": "counter_invalid" },
      { "id": "NF-009", "mutation": "counter_above_maximum", "expectedReasonCode": "counter_exhausted" },
      { "id": "NF-010", "mutation": "stale_fencing_token", "expectedReasonCode": "fencing_token_stale" },
      { "id": "NF-011", "mutation": "unsafe_fencing_token", "expectedReasonCode": "fencing_token_invalid" },
      { "id": "NF-012", "mutation": "invalid_status", "expectedReasonCode": "allocation_status_invalid" },
      { "id": "NF-013", "mutation": "reuse_committed_nonce", "expectedReasonCode": "nonce_reuse_detected" },
      { "id": "NF-014", "mutation": "rollback_high_watermark", "expectedReasonCode": "high_watermark_rollback" },
      { "id": "NF-015", "mutation": "corrupt_ledger", "expectedReasonCode": "ledger_corrupt" },
      { "id": "NF-016", "mutation": "duplicate_request_commit", "expectedReasonCode": "request_already_committed" },
      { "id": "NF-017", "mutation": "reuse_crash_reserved_nonce", "expectedReasonCode": "nonce_burned" },
      { "id": "NF-018", "mutation": "reuse_cancelled_nonce", "expectedReasonCode": "nonce_burned" },
      { "id": "NF-019", "mutation": "authorize_external_action", "expectedReasonCode": "authority_or_payload_flag_invalid" },
      { "id": "NF-020", "mutation": "include_sensitive_payload", "expectedReasonCode": "authority_or_payload_flag_invalid" },
      { "id": "NF-021", "mutation": "include_production_credential_material", "expectedReasonCode": "payload_or_credential_material_invalid" },
      { "id": "NF-022", "mutation": "global_disable_active", "expectedReasonCode": "global_disable_active" }
    ]
  },
  "rehearsalStore": {
    "kind": "operating_system_temporary_exclusive_nonce_allocation_anchor_request_encryption_and_quarantine_records",
    "outsideRepositoryRequired": true,
    "directoryMode": "0700",
    "recordMode": "0600",
    "exclusiveCreateRequired": true,
    "ephemeralCryptographicMaterialRequired": true,
    "highWatermarkAnchorRequired": true,
    "recordsAndKeysRemovedAfterRun": true,